{"evidence_id":"EVID-B1","attempt_id":"ATTEMPT-B1","commit_hash":"87654321","artifact_hashes":{"CR-1":"11111111","SPEC-B1":"22222222","TASK-B1":"33333333"},"runner":"local-test","operating_system":"windows","tool_versions":{"python":"3"},"started_at":"2026-01-01T00:30:00Z","ended_at":"2026-01-01T00:31:00Z","command":"python -m unittest regression","exit_code":0,"raw_log_path":".delivery/runs/ATTEMPT-B1.log","raw_log_hash":"d98e2b6452bcfc66614baab30cc69d97a63afa1f95d7001505d0695c07014dd6","test_selector":"regression and delta","passed":2,"failed":0,"skipped":0,"skip_reasons":[],"skip_approval_refs":[],"requirement_ids":["CR-1"],"test_ids":["TEST-CURRENT","TEST-TARGET"],"unverified_items":[],"valid_until":"2099-01-01T00:00:00Z","invalidation_conditions":["commit, config, or delta spec changes"]}
