{"evidence_id":"EVID-1","attempt_id":"ATTEMPT-1","commit_hash":"12345678","artifact_hashes":{"SPEC-1":"cccccccc","TASK-1":"dddddddd"},"runner":"local-test","operating_system":"windows","tool_versions":{"python":"3"},"started_at":"2026-01-01T00:30:00Z","ended_at":"2026-01-01T00:31:00Z","command":"python -m unittest","exit_code":0,"raw_log_path":".delivery/runs/ATTEMPT-1.log","raw_log_hash":"c323fb649e0824c78a6593b92f82c56bf57c4245a86e0333009ce2c50b70372d","test_selector":"TEST-1","passed":1,"failed":0,"skipped":0,"skip_reasons":[],"skip_approval_refs":[],"requirement_ids":["REQ-1"],"test_ids":["TEST-1"],"unverified_items":[],"valid_until":"2099-01-01T00:00:00Z","invalidation_conditions":["commit or spec hash changes"]}
